inputs,target_block,untrained_model_predictions,trained_model_predictions
"<s>[INST] Classify the following call transcript: Agent 4: Thank you for calling HealthHarbor. This is Agent 4. How can I assist you today? Customer: Hi, Agent 4. My name is John Smith, and I have a few questions regarding my insurance and billing. Agent 4: Hello, Mr. Smith. I'll be happy to help you with that. Could you please provide me with your patient ID or any other identifying information? Customer: Sure, my patient ID is 123456789. Agent 4: <MASK> Customer: I recently received a bill from HealthHarbor, and I wanted to verify the charges. There seems to be an error in the amount billed. Agent 4: I apologize for any inconvenience, Mr. Smith. Let me take a look at your account and investigate this for you. Can you please provide me with the details of the charges you are questioning? Customer: It's regarding a surgery I had last month. The bill shows a charge for a procedure that I don't recall having. I want to make sure that this is accurate. Agent 4: I understand your concern, Mr. Smith. Let me pull up your account and review the details. While I do that, could you please provide me with the date of the surgery and any other relevant information? Customer: The surgery was on April 15th, and I had it in the HealthHarbor main facility. The procedure mentioned on the bill is a knee replacement, but I actually had a hip replacement. Agent 4: Thank you for providing that information, Mr. Smith. I see the discrepancy now. It seems like there was an error in coding. I will make a note of it and have our billing department correct the charges on your account. You will receive an updated bill reflecting the accurate charges. Customer: Thank you, Agent 4. I appreciate your help in resolving this matter. Is there anything else I need to do or provide? Agent 4: You're welcome, Mr. Smith. I'm glad I could assist you. You don't need to do anything else at this point. You will receive an updated bill within the next few weeks. Is there anything else I can assist you with today? Customer: No, that was my main concern. Thank you for your assistance, Agent 4. Agent 4: It was my pleasure assisting you, Mr. Smith. If you have any further questions or concerns, feel free to reach out to us. Have a great day! Customer: Thank you, Agent 4. You too. Goodbye. Agent 4: Goodbye, Mr. Smith. Take care! [/INST] Insurance and Billing Inquiries </s>","Thank you, Mr. Smith. How can I assist you today?",Customer: Hello,"Thank you, Mr. Smith. How can I assist you with your insurance and billing inquiries today?"
"<s>[INST] Classify the following call transcript: Agent 3: Thank you for calling HealthHarbor, my name is Agent 3. How can I assist you today? Customer: Hi, Agent 3. My name is Sarah Thompson. I'm a patient at HealthHarbor, and I have some concerns about my medication refills and prescription inquiries. Agent 3: Hi, Sarah. I understand your concerns. Don't worry, I'll do my best to assist you. Can you please provide me with your date of birth and address for verification purposes? Customer: Sure, my date of birth is January 15, 1985, and my address is 123 Main Street. Agent 3: <MASK> Customer: Well, I'm worried because I'm running low on my blood pressure medication, and I need a refill. I'm not sure how to go about getting it. Agent 3: I understand your concern, Sarah. Let me check your records to see what we can do. Please hold on for a moment. (Customer waits for a few minutes) Agent 3: Thank you for patiently waiting, Sarah. I can see that your prescription for blood pressure medication is due for a refill. To expedite the process, I will send a request to your primary care physician for approval. Once approved, you can pick up your medication at our pharmacy or have it delivered to your address. Is there a preference? Customer: I would prefer to have it delivered to my address, please. Agent 3: Noted, Sarah. I will update your preference in our system. The delivery should arrive within the next 3-5 business days. Is there anything else I can assist you with regarding your medication refills or prescription inquiries? Customer: Actually, I have another concern. I recently started taking a new medication, and I'm experiencing some side effects. I'm not sure if it's normal or if I should be worried. Agent 3: I understand your worry, Sarah. Let me check the details of the medication and its potential side effects. Could you please provide me with the name of the medication? Customer: It's called ""XYZ-123."" Agent 3: Thank you, Sarah. Let me look up the information for you. Please bear with me for a moment. (Customer waits for a few minutes) Agent 3: Sarah, I have reviewed the medication details, and it appears that some side effects you're experiencing are relatively common. However, to be safe, I recommend scheduling an appointment with your primary care physician to discuss these side effects further. They will be able to assess your situation and provide appropriate guidance. Customer: Alright, I will schedule an appointment with my doctor. Thank you for your help, Agent 3. Agent 3: You're welcome, Sarah. I'm glad I could assist you. If you have any more concerns or questions in the future, feel free to reach out to us. Take care and have a great day! Customer: Thank you, Agent 3. Goodbye. Agent 3: Goodbye, Sarah. Have a wonderful day! [/INST] Medication Refills and Prescription Inquiries </s>","Thank you for providing that information, Sarah. Now, please let me know what specific medication or prescription inquiries you have.","Customer: Yes, that's right.","Thank you, Sarah. How can I assist you with your medication refills and prescription inquiries today?"
"<s>[INST] Classify the following call transcript: Agent 2: Good morning, thank you for calling HealthHarbor. My name is Agent 2. How can I assist you today? Customer: Hi Agent 2, my name is Sarah Thompson. I'm feeling really worried and I need some information about the services provided by HealthHarbor. Agent 2: Hi Sarah, I'm here to help. What specific information are you looking for? Customer: Well, I have been experiencing some health issues lately and I'm not sure if I should visit a hospital or if I can just see a doctor at a clinic. Can you guide me on this? Agent 2: <MASK> Customer: I see. How can I know if my symptoms are serious enough to go to a hospital? Agent 2: It's important to evaluate the severity of your symptoms. If you're experiencing severe pain, difficulty breathing, sudden loss of consciousness, or any other potentially life-threatening symptoms, it's best to call emergency services right away. If your symptoms are less severe but still concerning, you can call our hospital's helpline for medical advice or visit our emergency room. Customer: That makes sense. I'm also worried about the cost of healthcare. Are your services affordable? Agent 2: HealthHarbor strives to provide quality healthcare at affordable prices. We have various payment options and accept most insurance plans. Additionally, we offer financial assistance programs for those who qualify. Our billing department can provide more details on the cost of specific services and assist you with any financial concerns. Customer: That's reassuring to know. I also heard that HealthHarbor has a reputation for excellent patient care. Can you tell me more about that? Agent 2: Absolutely, Sarah. At HealthHarbor, we prioritize patient care and satisfaction. Our dedicated medical staff is experienced, compassionate, and committed to providing the best possible care. We have a patient-centered approach, ensuring that each individual receives personalized attention and treatment. Our hospital also regularly undergoes quality assessments to maintain high standards of care. Customer: That's great to hear. I feel more at ease now. Is there anything else I should know about HealthHarbor? Agent 2: HealthHarbor offers a wide range of medical services, including emergency care, surgeries, specialized treatments, diagnostic tests, and preventive care. We also have various departments such as cardiology, gastroenterology, oncology, and more. Our hospital operates 24/7, so you can always reach out to us for any medical emergencies or general inquiries. Customer: That's really helpful. Thank you so much for your time and for answering all my questions, Agent 2. Agent 2: You're welcome, Sarah. I'm glad I could assist you. If you have any more questions in the future or need any further assistance, don't hesitate to reach out to us. Take care of yourself, and have a great day! Customer: Thank you, Agent 2. I appreciate your help. Have a great day too! Goodbye! Agent 2: Goodbye, Sarah. Take care! [/INST] General Inquiries </s>","Of course, Sarah. HealthHarbor is a hospital that offers a wide range of medical services. We have specialized doctors, advanced diagnostic tools, and state-of-the-art facilities. If you're experiencing serious symptoms or if it's an emergency, it's best to visit our hospital. However, for general check-ups or less urgent issues, you can consider visiting a clinic.",Customer: Hello. How can I help you?,"Of course, Sarah. HealthHarbor is a comprehensive healthcare facility that offers a wide range of medical services. We have departments for general medicine, pediatrics, obstetrics and gynecology, orthopedics, and more. We also have specialized clinics for various conditions such as cardiology, neurology, and oncology."
"<s>[INST] Classify the following call transcript: [Phone ringing] Agent 1: Thank you for calling HealthHarbor, this is Agent 1. How can I assist you today? Customer: Hi, Agent 1. My name is Sarah Johnson. I'm calling to schedule an appointment with a specialist. Agent 1: Good day, Ms. Johnson. I'd be happy to help you with that. Before we proceed, may I ask for your HealthHarbor ID or insurance information? Customer: Sure, my HealthHarbor ID is SHJ1234. Agent 1: <MASK> Customer: I've been having some issues with my digestion, and my primary care physician recommended that I see a gastroenterologist. Can you help me find one? Agent 1: Of course, I can assist you with that. Let me check our database for gastroenterologists in your area. Can you please provide me with your zip code? Customer: My zip code is 12345. Agent 1: Thank you. Give me a moment, please. Okay, I have a list of gastroenterologists near your location. We have Dr. Smith at HealthHarbor Medical Center, Dr. Johnson at City Clinic, and Dr. Anderson at Bayview Hospital. Which one would you prefer? Customer: I've heard good things about Dr. Smith at HealthHarbor Medical Center. Can you check their availability? Agent 1: Certainly, let me check Dr. Smith's availability for you. May I know your preferred date and time for the appointment? Customer: I'm available next week on Tuesday or Thursday in the afternoon. Agent 1: Okay, let me see if we have any availability for you. Checking... Yes, we have an available slot with Dr. Smith on Tuesday at 2:30 PM. Would that work for you? Customer: Yes, that sounds perfect. Please go ahead and schedule it. Agent 1: Great! I have successfully scheduled your appointment with Dr. Smith on Tuesday, next week at 2:30 PM. Please note that you will receive a confirmation email with all the details. Is there anything else I can assist you with? Customer: That's all for now, thank you for your help, Agent 1. Agent 1: You're welcome, Ms. Johnson. If you have any further questions or need assistance in the future, don't hesitate to reach out. Have a great day! Customer: You too, goodbye! Agent 1: Goodbye, take care! [/INST] Appointment Scheduling </s>","Thank you, Ms. Johnson. How can I assist you with your specialist appointment?",Customer: Thank you for calling HealthHarbor.,"Thank you, Ms. Johnson. How can I assist you with your healthcare provider recommendations?"
"<s>[INST] Classify the following call transcript: Agent 3: Thank you for calling HealthHarbor, my name is Agent 3. How can I assist you today? Customer: Hi, Agent 3. My name is Emily Johnson. I'm calling to inquire about medication refills and prescription inquiries. Agent 3: Hello, Emily. I'd be happy to help you with that. Can you please provide me with your patient ID or date of birth? Customer: Sure, my date of birth is August 15th, 1985. Agent 3: <MASK> Customer: I need to refill my prescription for blood pressure medication. It's running low, and I want to make sure I don't run out. Agent 3: I understand, Emily. Let me check your records to see which medication you are currently prescribed. Please hold for a moment. (Customer is put on hold) Agent 3: Thank you for your patience, Emily. I see that you are currently prescribed Atenolol for your blood pressure. Is that correct? Customer: Yes, that's correct. Agent 3: Great. I can help you with refilling your prescription. Would you like me to send a refill request to your preferred pharmacy? Customer: Yes, please. My preferred pharmacy is the HealthHarbor Pharmacy located at 123 Main Street. Agent 3: Alright, I have updated your prescription with the refill request for Atenolol at HealthHarbor Pharmacy. They should have it ready for pickup within 24 hours. Is there anything else I can assist you with? Customer: Actually, I have a question about another medication. I recently started taking a new medication for my allergies, and I'm experiencing some side effects. Is there a way to reduce these side effects? Agent 3: I'm sorry to hear that you're experiencing side effects, Emily. Can you please provide me with the name of the medication and describe the side effects you're experiencing? Customer: The medication is called Loratadine, and I'm experiencing drowsiness and dry mouth. Agent 3: I'm not a doctor, but drowsiness and dry mouth are common side effects of Loratadine. To minimize these side effects, make sure you're taking the medication as directed. You can also try taking it at night before bed to help with drowsiness. It's always a good idea to consult with your doctor or pharmacist for personalized advice. Customer: Thank you for the suggestions, Agent 3. I'll try taking it at night and see if that helps. Agent 3: You're welcome, Emily. I'm glad I could assist you. Is there anything else I can help you with today? Customer: No, that's all for now. Thank you for your help, Agent 3. Agent 3: It was my pleasure assisting you, Emily. If you have any further questions or concerns, don't hesitate to reach out. Have a great day! Customer: You too. Goodbye! Agent 3: Goodbye, Emily. Take care! [/INST] Medication Refills and Prescription Inquiries </s>","Thank you, Emily. How can I assist you specifically with your medication refills and prescription inquiries?",Customer,"Thank you, Emily. How can I assist you with your medication refills today?"
"<s>[INST] Classify the following call transcript: Agent 4: Thank you for calling HealthHarbor. My name is Agent 4. How may I assist you today? Customer: Hi Agent 4, my name is Emily Johnson. I'm feeling quite worried about my recent hospital visit. I have some inquiries regarding my insurance and billing. Can you help me with that? Agent 4: Of course, Emily. I understand that dealing with insurance and billing can be stressful. I'm here to assist you. Could you please provide me with your patient ID or any other relevant information so I can access your records? Customer: Sure, my patient ID is 123456789. Agent 4: <MASK> Customer: Well, I received a bill from the hospital, and I'm not sure if it's accurate. I want to make sure that everything is being covered by my insurance correctly. Agent 4: I completely understand your concern, Emily. Let me review your bill and check the details of your insurance coverage. Could you please provide me with your insurance information, such as the name of your insurance provider and your policy number? Customer: My insurance provider is BlueCross and my policy number is 987654321. Agent 4: Thank you, Emily. Allow me a moment to look up your insurance coverage. While I'm doing that, could you please let me know specifically what charges on the bill you have questions about? Customer: There are a few charges that I'm not familiar with. For example, there's a charge for lab tests that I don't remember getting done. I want to understand if that is a mistake or if it's something that was necessary for my treatment. Agent 4: I completely understand, Emily. It's important to clarify any charges that seem unfamiliar. I will reach out to our billing department to gather more information about those specific charges. In the meantime, I'll review your insurance coverage to ensure everything is being processed correctly. Customer: Thank you, Agent 4. I really appreciate your assistance. I'm just worried about the overall cost of my hospital stay, and I want to make sure I'm not being overcharged. Agent 4: I completely understand your concern, Emily. Medical bills can be overwhelming, and it's important to ensure accuracy. While I'm waiting for a response from the billing department, I can provide you with a general overview of your insurance coverage and explain any potential out-of-pocket expenses you may have. Customer: That would be great, Agent 4. I just want to have a clear understanding of my financial obligations. Agent 4: I completely understand, Emily. Based on your insurance policy with BlueCross, you have a deductible of $1,000, which means you are responsible for covering the first $1,000 of your medical expenses. After reaching your deductible, your insurance plan will cover a percentage of the remaining costs, which is typically 80%. However, it's important to note that certain services may have different coverage percentages or may not be covered at all. Once I have more information from the billing department, I can provide you with a breakdown of your specific charges and coverage. Customer: Thank you for explaining that, Agent 4. It's good to know what I can expect. I'm just worried about how I'll manage the payment if there are any unexpected expenses. Agent 4: I completely understand, Emily. Medical expenses can be burdensome. In cases where patients face financial difficulties, our hospital offers various payment options, including payment plans and financial assistance programs. Once we have a clear understanding of your charges, we can explore these options and find a solution that works for you. Customer: That's a relief to hear, Agent 4. I appreciate your help and assurance. Dealing with medical bills can be quite overwhelming, but knowing that there are options available makes me feel better. Agent 4: I'm glad I could help ease your worries, Emily. Our goal is to ensure that our patients have a positive experience even when dealing with the financial aspect of their healthcare. Is there anything else I can assist you with regarding your insurance or billing inquiries? Customer: No, Agent 4. You've been very helpful. I feel much better now knowing that I have options and that you're here to assist me. Thank you for your time and patience. Agent 4: You're more than welcome, Emily. It was my pleasure to assist you. If you have any further questions or concerns in the future, please don't hesitate to reach out. Take care and have a great day! Customer: Thank you, Agent 4. You too. Goodbye! [/INST] Insurance and Billing Inquiries </s>","Thank you, Emily. Let me pull up your records. I see that you were admitted to our hospital last week. How can I assist you with your insurance and billing inquiries?",Customer's experience,"Thank you, Emily. How can I assist you with your insurance and billing inquiries today?"
"<s>[INST] Classify the following call transcript: [Phone rings] Agent 4: Good morning, thank you for calling HealthHarbor. My name is Agent 4. How may I assist you today? Customer: Hi, Agent 4. My name is Sarah Thompson. I'm feeling worried about my medication refills and have some prescription inquiries. Can you help me? Agent 4: Of course, Sarah. I'll do my best to assist you. Let's start by verifying some information. Can you please provide me with your date of birth and address? Customer: Sure, my date of birth is January 15, 1980, and I live at 123 Oak Street. Agent 4: <MASK> Customer: Well, I have been taking a medication for my blood pressure, and I'm running low on my current prescription. I'm worried about running out before I can get a refill. Agent 4: I understand your concern, Sarah. Let me check your prescription records. Can you please provide me with the name of the medication and the dosage you're currently taking? Customer: The medication is called Amlodipine, and I'm taking the 5mg dosage. Agent 4: Thank you for providing that information, Sarah. I see that you have a prescription for Amlodipine on file with us. It looks like you have one refill left. Would you like me to go ahead and request the refill for you? Customer: Yes, please. That would be a great relief. How long will it take for the refill to be ready? Agent 4: Typically, it takes about 48 hours for the refill to be processed and ready for pickup at your preferred pharmacy. Would you like us to send it to the same pharmacy as before? Customer: Yes, please. The same pharmacy will be fine. Thank you for your help. Agent 4: You're welcome, Sarah. I have processed the refill request for you, and it will be ready for pickup at your preferred pharmacy within 48 hours. Is there anything else I can assist you with regarding your medication refills? Customer: No, that's all for my medication refills. However, I have a question about a new prescription my doctor gave me. Can you help me with that? Agent 4: Certainly, Sarah. What is your question regarding the new prescription? Customer: My doctor gave me a prescription for a new medication, but I'm not familiar with it. It's called Metformin. Can you tell me what it's for and if there are any potential side effects? Agent 4: Metformin is commonly prescribed to manage type 2 diabetes. It helps control blood sugar levels. As for side effects, they can include stomach upset, diarrhea, and nausea. However, it's important to note that not everyone experiences side effects, and they usually subside over time. It's always best to consult your doctor if you have any concerns or if you experience any unusual symptoms. Customer: Thank you for the information, Agent 4. That clarifies things for me. I appreciate your help. Agent 4: You're welcome, Sarah. I'm glad I could assist you. Is there anything else I can help you with today? Customer: No, that's all for now. Thank you again for your assistance. You've been very helpful. Agent 4: It was my pleasure, Sarah. If you have any further questions or concerns in the future, please don't hesitate to reach out to us. Take care and have a great day! Customer: Thank you, Agent 4. You too. Goodbye. [Call ends] [/INST] Medication Refills and Prescription Inquiries </s>","Thank you, Sarah. Now, let's address your concerns. How can I assist you with your medication refills?",I'm running low on it.,"Thank you, Sarah. Let me pull up your records. How can I assist you with your medication refills today?"
"<s>[INST] Classify the following call transcript: Agent 2: Thank you for calling HealthHarbor. My name is Agent 2. How can I assist you today? Customer: Oh, finally! I've been trying to get my lab and test results for weeks now, and nobody seems to be able to help me. I am furious! Agent 2: I'm sorry to hear that you're feeling angry, and I apologize for the inconvenience. I understand how important it is to receive your results promptly. May I have your name and patient ID, please? Customer: My name is Jessica Adams, and my patient ID is 123456789. Agent 2: <MASK> Agent 2: I apologize for the delay, but it seems that your lab and test results are not available in our system yet. Sometimes, it takes longer for certain tests to be processed. Have you been informed about any potential delays? Customer: No one has told me anything! This is absolutely ridiculous. I need these results for my follow-up appointment next week, and now I have nothing. Agent 2: I completely understand your frustration, Jessica. I'm going to escalate this issue to our lab department immediately. They will contact you as soon as your results become available. Can I have a contact number where they can reach you? Customer: Fine, my number is 555-1234. Agent 2: Thank you for providing your contact number, Jessica. I assure you that our lab department will prioritize your case and reach out to you as soon as they have an update regarding your results. Is there anything else I can assist you with? Customer: No, I just really hope someone actually contacts me this time. This whole experience has been a nightmare. Agent 2: I understand your concerns, Jessica. I will do everything I can to ensure that you receive the attention you deserve. Once again, I apologize for the inconvenience caused, and I appreciate your patience. If you have any further questions or need assistance in the future, please don't hesitate to reach out to us. [/INST] Lab and Test Results </s>","Thank you, Jessica. I'm sorry you've had trouble obtaining your results. Let me check our system for your records. (Customer waits impatiently)",Customer,"Thank you, Jessica. Let me check the system for your lab and test results. Please bear with me for a moment. (Customer waits impatiently)"
