inputs,target_block,untrained_model_predictions,trained_model_predictions
"<s>[INST] Classify the following call transcript: Agent 4: Thank you for calling HealthHarbor. My name is Agent 4. How may I assist you today? Customer: Hi, Agent 4. My name is Emily Johnson. I have some general inquiries about the services provided at HealthHarbor. Agent 4: Hello, Emily. I'm here to help. What specific information are you looking for? Customer: Well, first of all, I wanted to know what kind of medical services are offered at HealthHarbor. Agent 4: <MASK> Customer: That's great to hear. Can you tell me if HealthHarbor accepts insurance? Agent 4: Yes, Emily. We work with most major insurance providers. However, it would be best to contact your insurance company directly to confirm coverage at HealthHarbor. Customer: Alright, I'll do that. Can you also tell me about the availability of specialists at your hospital? Agent 4: Certainly, Emily. HealthHarbor has a team of highly skilled specialists in various fields such as cardiology, orthopedics, neurology, and more. We strive to provide comprehensive care to meet our patients' needs. Customer: That's reassuring to know. I also wanted to inquire about the visiting hours for patients at HealthHarbor. Agent 4: Our visiting hours are from 9 am to 9 pm, seven days a week. However, due to the ongoing COVID-19 pandemic, we have implemented certain restrictions on visitation. It's always best to check with the hospital staff for the most up-to-date information regarding visitation policies. Customer: Understood. One more thing, are there any support services available for patients and their families? Agent 4: Absolutely, Emily. At HealthHarbor, we understand the importance of emotional support during difficult times. We have social workers, counselors, and chaplains available to provide support to patients and their families. We also offer various support groups and educational programs. Customer: That's really helpful to know. Thank you for all the information, Agent 4. Is there anything else I should be aware of? Agent 4: You're welcome, Emily. I'm glad I could assist you. If you have any further questions or need assistance in the future, please don't hesitate to reach out to us. Have a great day! Customer: Thank you, Agent 4. I appreciate your assistance. Have a great day too! Agent 4: You're welcome, Emily. Take care and stay healthy. Goodbye! [/INST] General Inquiries </s>","HealthHarbor is a full-service hospital, offering a wide range of medical services. We provide emergency care, surgeries, diagnostic imaging, laboratory services, maternity care, and much more.",Customer: Thank you for calling HealthHarbor.,"HealthHarbor is a comprehensive healthcare facility that offers a wide range of medical services. We have departments for general medicine, surgery, pediatrics, obstetrics and gynecology, orthopedics, and more. We also have specialized clinics for various conditions such as diabetes, cancer, and mental health."
"<s>[INST] Classify the following call transcript: [Phone ringing] Agent 3: Thank you for calling HealthHarbor. My name is Agent 3. How may I assist you today? Customer: Hi, Agent 3. My name is Emily Johnson. I have a few questions regarding my insurance and billing. Agent 3: Hi, Emily. I'll be happy to help you with that. Could you please provide me with your date of birth and the name of your insurance provider? Customer: Sure. My date of birth is January 15, 1985, and my insurance provider is BlueCross. Agent 3: <MASK> Customer: I recently received a bill from the hospital for a procedure I had last month. I just wanted to confirm if it was covered by my insurance and if there's anything else I need to do regarding the payment. Agent 3: I understand your concern, Emily. Let me check the details of the procedure and your insurance coverage. Could you please provide me with the date of the procedure and any reference numbers mentioned on the bill? Customer: The procedure was done on June 23, 2022, and the reference number on the bill is 123456789. Agent 3: Thank you for the information, Emily. Let me pull up your file and check the details. Please bear with me for a moment. [Pause] Agent 3: Emily, I have reviewed your file, and I can see that the procedure you had on June 23, 2022, is indeed covered by your insurance. However, there seems to be a portion of the bill that is not covered. This is called a co-payment, which is the amount you are responsible for paying out of pocket. Customer: Oh, I see. Can you please let me know the amount of the co-payment and how I can make the payment? Agent 3: Certainly, Emily. The co-payment amount is $150. You can make the payment through our online portal, over the phone, or by mail. Which option would you prefer? Customer: I would prefer to make the payment online. Can you guide me through the process? Agent 3: Of course, Emily. To make the payment online, you can visit our website at www.healthharbor.com and navigate to the billing section. There you will find a link to our secure payment portal. Once you click on the link, you will be prompted to enter your patient information and the payment amount. After submitting the payment, you will receive a confirmation email. Customer: That sounds straightforward. I'll make the payment online as soon as we finish this call. Is there anything else I need to know regarding my insurance coverage? Agent 3: Yes, Emily. It's important to keep in mind that insurance coverage may vary depending on the specific plan you have with BlueCross. I recommend checking your insurance policy or contacting your insurance provider directly for any additional details or questions you may have regarding your coverage. Customer: Thank you for the reminder. I will reach out to BlueCross for further clarification if needed. Is there anything else I should be aware of regarding my billing? Agent 3: No, Emily. Once you make the co-payment, your bill will be considered settled. However, if you have any further questions or concerns in the future, feel free to reach out to us, and we'll be happy to assist you. Customer: That's good to know. Thank you for your help, Agent 3. You've been very informative and patient with me today. Agent 3: You're welcome, Emily. It's my pleasure to assist you. Is there anything else I can help you with today? Customer: No, that's all for now. Thank you again, Agent 3. Have a great day! Agent 3: You're welcome, Emily. Have a wonderful day too! Take care. [End of the call] [/INST] Insurance and Billing Inquiries </s>","Thank you, Emily. How can I assist you with your insurance and billing inquiries today?","Customer: Hello, Agent 3. How may I assist you today?","Thank you, Emily. How can I assist you with your insurance and billing inquiries today?"
"<s>[INST] Classify the following call transcript: Agent 4: Thank you for calling HealthHarbor. My name is Agent 4. How can I assist you today? Customer: Hi, Agent 4. My name is John Smith. I'm calling because I'm looking for information about your healthcare facility. Agent 4: Hello, Mr. Smith. I'd be happy to provide you with any information you need. What specific details are you looking for? Customer: Well, I recently moved to this area and I'm in need of a new healthcare provider. Can you tell me what services HealthHarbor offers? Agent 4: <MASK> Customer: That sounds great. How about the availability of doctors and specialists? Agent 4: Our hospital has a dedicated team of doctors and specialists available around the clock. We have a large network of physicians covering various specialties, ensuring that our patients receive expert care in all areas of medicine. Customer: That's reassuring to hear. Can you tell me about the facilities and technology at HealthHarbor? Agent 4: Of course, Mr. Smith. HealthHarbor is equipped with state-of-the-art facilities and advanced medical technology. We have modern operating rooms, diagnostic imaging centers, and a fully equipped laboratory. Our goal is to provide our patients with the best possible care using the latest medical advancements. Customer: That's impressive. I'm also concerned about insurance coverage. Does HealthHarbor accept a wide range of insurance plans? Agent 4: Yes, we work with most major insurance providers. However, I would recommend contacting your insurance company directly to confirm if HealthHarbor is in-network for your specific plan. Our billing department can also assist you in understanding your coverage and any potential out-of-pocket expenses. Customer: That's good to know. Is there anything else I should be aware of before considering HealthHarbor as my healthcare provider? Agent 4: One important thing to mention is our commitment to patient satisfaction. We strive to provide compassionate care and ensure a positive experience for all our patients. We have a patient feedback system in place to continuously improve our services. Additionally, we offer various patient support programs and resources to assist with your healthcare journey. Customer: That's great to hear. I appreciate all the information, Agent 4. I believe I have a good understanding of what HealthHarbor has to offer. Thank you for your assistance. Agent 4: You're welcome, Mr. Smith. If you have any further questions or if there's anything else I can help you with in the future, please don't hesitate to reach out. We would be thrilled to have you as part of the HealthHarbor family. Have a wonderful day! Customer: Thank you, Agent 4. I will definitely keep HealthHarbor in mind. Have a great day too! Goodbye. Agent 4: Goodbye, Mr. Smith. Take care! [/INST] Healthcare Facility Information </s>","Absolutely, Mr. Smith. HealthHarbor is a full-service hospital that offers a wide range of medical services. We have departments for emergency care, surgery, maternity, pediatrics, internal medicine, and more. We also have specialized clinics for cardiology, oncology, and orthopedics.",Agent 4,"Absolutely, Mr. Smith. HealthHarbor is a comprehensive healthcare facility that offers a wide range of medical services. We have departments for general medicine, pediatrics, obstetrics and gynecology, orthopedics, and more. We also have specialized clinics for cardiology, neurology, and oncology."
"<s>[INST] Classify the following call transcript: Agent 1: Good morning, thank you for calling HealthHarbor. My name is Agent 1. How can I assist you today? Customer: Hi, Agent 1. My name is Sarah Thompson. I recently had a surgery at HealthHarbor, and I have some concerns about my recovery. Agent 1: Hello, Sarah. I'm sorry to hear that you're feeling worried. Don't worry, I'm here to help. Could you please provide me with your date of surgery and the name of your surgeon? Customer: My surgery was on October 15th, and my surgeon's name was Dr. Johnson. Agent 1: <MASK> Customer: Well, I'm experiencing more pain than I expected, and I'm having difficulty with mobility. It's been two weeks since the surgery, and I expected to feel better by now. Agent 1: I understand your concerns, Sarah. Recovery time can vary from person to person, and it's not uncommon to experience some pain and discomfort. However, I'll make a note of your concerns and schedule a follow-up appointment with Dr. Johnson. He will be able to assess your progress and provide further guidance. Customer: Thank you, Agent 1. I appreciate your help. I'm just worried that something might be wrong. Agent 1: I completely understand, Sarah. It's natural to feel worried, especially after a major surgery. Our main goal is to ensure your well-being. In the meantime, I would recommend continuing with any prescribed pain medication and following the post-operative care instructions given to you by the hospital. Customer: Alright, I'll make sure to do that. Is there anything else I should be doing to aid my recovery? Agent 1: Besides taking your medication and following the care instructions, it's important to engage in physical therapy as advised by your surgeon. Physical therapy will help improve your mobility and strengthen the muscles around your knee. Additionally, make sure to rest and avoid any activities that may strain your knee. Customer: I'll definitely keep that in mind. Thank you for your guidance, Agent 1. It's reassuring to know that HealthHarbor is there for me. Agent 1: You're welcome, Sarah. We're always here to support our patients. If you have any other questions or concerns, please don't hesitate to reach out. We want to ensure your recovery goes smoothly. Customer: I really appreciate your help, Agent 1. You've been very reassuring. Thank you for your time. Agent 1: It was my pleasure, Sarah. I'm glad I could help alleviate some of your worries. Take care, and I hope you have a speedy recovery. Don't hesitate to call us if you need anything else. Have a great day! Customer: Thank you, Agent 1. I will. Goodbye! [/INST] Follow-up Calls and Care Management </s>","Thank you for the information, Sarah. Let me just pull up your file. Alright, I see here that you had a knee replacement surgery. How has your recovery been so far?",Customer,"Thank you, Sarah. Let me pull up your records. How can I assist you with your recovery concerns?"
"<s>[INST] Classify the following call transcript: Agent 4: Thank you for calling HealthHarbor, my name is Agent 4. How can I assist you today? Customer: Finally, someone answered! I've been on hold for ages! I need some referrals and specialist appointments, and I want them now! Agent 4: I apologize for the wait, and I understand your frustration. I'll do my best to help you. May I have your name, please? Customer: My name is John Smith. Agent 4: <MASK> Customer: Oh, come on! I've already provided that information when I called. Can't you see it on your screen? Agent 4: I apologize for any inconvenience, Mr. Smith. I can see your information now. How can I assist you with referrals and specialist appointments? Customer: I've been experiencing some severe back pain, and I need to see a specialist. My primary care physician referred me, but I need to schedule an appointment as soon as possible. Agent 4: I understand your urgency, Mr. Smith. Let me pull up our list of available specialists in your area. While I search, could you please provide me with your preferred location? Customer: I live in the downtown area, so any specialist near that area would be great. Agent 4: Thank you for that information, Mr. Smith. I have found a few specialists near your location. Let me check their availability for you. (Customer and Agent 4 wait for a few minutes as the agent checks the availability.) Agent 4: Good news, Mr. Smith! I have found a specialist who can see you tomorrow at 2:00 PM. Would that work for you? Customer: Finally, some progress! Yes, that works for me. Can you please provide me with the specialist's name and the address of the clinic? Agent 4: Absolutely, Mr. Smith. You will be seeing Dr. Emily Johnson at the Downtown Medical Center. The address is 123 Main Street, Suite 456. Customer: Okay, got it. And what about the referrals? My primary care physician mentioned that I would need referrals for the specialist visits. Agent 4: I can assist you with that as well, Mr. Smith. I will generate the necessary referrals and email them to you within the next 30 minutes. Is there any other assistance you require? Customer: No, that will be all. Just make sure you actually send those referrals on time, unlike the previous call center I dealt with. Agent 4: I apologize for any inconvenience you may have experienced in the past, Mr. Smith. I assure you that we take your concerns seriously, and I will make sure the referrals are sent promptly. Is there anything else I can assist you with today? Customer: No, that's all. Just make sure everything goes smoothly this time. Agent 4: I understand your concern, Mr. Smith. Rest assured, we will do our best to ensure a smooth process for you. If you have any further questions or need assistance in the future, please don't hesitate to reach out. Thank you for choosing HealthHarbor, and I hope you have a pleasant day! Customer: Thank you. Goodbye. [/INST] Referrals and Specialist Appointments </s>","Thank you, Mr. Smith. Before we proceed, could you please verify your date of birth and the last four digits of your social security number for security purposes?",Agent 4: Thank you for calling HealthHarbor.,"Thank you, Mr. Smith. Could you please provide me with your date of birth and the name of the specialist you're looking to see?"
"<s>[INST] Classify the following call transcript: Agent 2: Thank you for calling HealthHarbor, my name is Agent 2. How can I assist you today? Customer: Hi Agent 2, my name is Jessica Thompson. I need some help with referrals and specialist appointments. Agent 2: Of course, Jessica. I'll do my best to assist you. Can you please provide me with your HealthHarbor member ID? Customer: Sure, my member ID is 123456789. Agent 2: <MASK> Customer: Well, I've been experiencing some back pain lately, and I think I may need to see a specialist. Can you help me find one? Agent 2: Absolutely, Jessica. I'm sorry to hear about your back pain. Let me check our database for a specialist in your area. Could you please provide me with your zip code? Customer: Yes, my zip code is 12345. Agent 2: Thank you, Jessica. I'm searching for a specialist near your location. While I do that, could you please let me know which type of specialist you're looking for? Customer: I think I need to see an orthopedic specialist for my back pain. Agent 2: Alright, Jessica. I'm searching for orthopedic specialists in your area now. In the meantime, could you please let me know if you have a preferred hospital or any specific requirements for the specialist? Customer: No, I don't have a preferred hospital, but I would prefer a specialist who has experience in treating back pain. Agent 2: Understood, Jessica. I'll keep that in mind. I found a few orthopedic specialists near your location. Let me provide you with their names and contact information. Please note that availability may vary, and it's always a good idea to call them directly to schedule an appointment. (Customer and Agent 2 go through the list of orthopedic specialists in the area.) Customer: Thank you for providing me with the list, Agent 2. I'll reach out to them and schedule an appointment. Agent 2: You're welcome, Jessica. I hope you find a specialist who can help you with your back pain. Is there anything else I can assist you with today? Customer: Actually, yes. I also need a referral for a dermatologist. I've been having some skin issues lately. Agent 2: I'm sorry to hear that, Jessica. Let me check our database for dermatologists near you. Could you please provide me with your zip code again? Customer: Sure, my zip code is still 12345. Agent 2: Thank you, Jessica. I'm searching for dermatologists in your area now. While I do that, could you please let me know if you have any specific preferences or requirements for the dermatologist? Customer: No specific preferences, just someone who is knowledgeable and experienced in treating various skin conditions. Agent 2: I understand, Jessica. I found a few dermatologists near your location. Let me provide you with their names and contact information. Again, please note that availability may vary, so it's best to contact them directly to schedule an appointment. (Customer and Agent 2 go through the list of dermatologists in the area.) Customer: Thank you so much for your help, Agent 2. I really appreciate it. Agent 2: You're welcome, Jessica. I'm glad I could assist you. Is there anything else I can help you with today? Customer: No, that's all for now. Thanks again for your assistance. Agent 2: You're welcome, Jessica. If you have any more questions or need further assistance, don't hesitate to give us a call. Have a great day! Customer: Thank you, you too. Goodbye. Agent 2: Goodbye, Jessica. Take care. [/INST] Referrals and Specialist Appointments </s>","Thank you, Jessica. How can I assist you with referrals and specialist appointments today?",Customer for calling HealthHarbor.,"Thank you, Jessica. How can I help you with referrals and specialist appointments today?"
"<s>[INST] Classify the following call transcript: Agent 1: Thank you for calling HealthHarbor, my name is Agent 1. How can I assist you today? Customer: Hi, Agent 1. I'm calling because I have some questions about my insurance coverage and billing inquiries. Agent 1: Of course, I'll be happy to help you with that. Could I please have your name and policy number to access your information? Customer: My name is Emily Johnson, and my policy number is 123456789. Agent 1: <MASK> Customer: Well, I recently had a procedure done at HealthHarbor and I received a bill that seems higher than I expected. I wanted to understand the charges and make sure everything is covered by my insurance. Agent 1: I understand your concern, Emily. Let me pull up your account and review the charges for you. It may take me a moment, please bear with me. (Customer waits) Agent 1: Thank you for your patience, Emily. I have reviewed your bill, and it seems that there was an error in the coding for the procedure. I apologize for the confusion. I will make sure to correct it right away. Customer: Thank you, Agent 1. I appreciate your help. Will I be responsible for the corrected charges? Agent 1: No, Emily. Once the coding error is corrected, the updated bill will be submitted to your insurance provider. You will not be responsible for any additional charges resulting from the error. Customer: That's a relief. Thank you for clarifying that. I also wanted to inquire about the coverage for a specific medication I need to take regularly. It seems that my insurance is not covering it fully. Agent 1: I'm sorry to hear about that, Emily. Medication coverage can vary depending on your insurance plan. Could you please provide me with the name of the medication? Customer: It's called XYZ medication. Agent 1: Alright, let me check the coverage for XYZ medication under your insurance plan. Please give me a moment. (Customer waits) Agent 1: Thank you for waiting, Emily. It appears that XYZ medication is indeed covered under your insurance plan, but it requires prior authorization. Have you discussed this with your healthcare provider? Customer: No, I haven't. I wasn't aware that prior authorization was needed. How can I go about getting that? Agent 1: I can assist you with that, Emily. I will provide you with the necessary forms and guide you through the process. I will also reach out to your healthcare provider to expedite the authorization. Can I have your preferred email address to send you the forms? Customer: Sure, my email address is emily.johnson@email.com. Agent 1: Thank you, Emily. I will send you the forms shortly. Please keep an eye on your email and feel free to reach out to me if you have any further questions or need assistance with the process. Customer: Thank you so much, Agent 1. I appreciate your help and prompt response. Agent 1: You're welcome, Emily. It's my pleasure to assist you. Is there anything else I can help you with today? Customer: No, that's all for now. Thank you again for your assistance. Agent 1: You're welcome, Emily. Have a great day! (Customer and Agent 1 end the call) [/INST] Insurance and Billing Inquiries </s>","Thank you, Emily. How can I assist you with your insurance coverage and billing inquiries today?",Prior authorization for XYZ medication,"Thank you, Emily. How can I assist you with your insurance and billing inquiries today?"
